y_label,headline,pub_date,snippet,web_url
0,"Rebuilding Puerto Rico, One Small Gesture at a Time",2017-12-17T12:00:27+0000,"Since Hurricane Maria steamrollered Puerto Rico, the day-to-day job of digging out, sometimes block by block, has fallen largely to island residents.",https://www.nytimes.com/2017/12/17/us/puerto-rico-hurricane-tito-el-bambino.html
0,Disaster Relief Bill at an Impasse Over Puerto Rico Aid,2019-03-28T23:41:10+0000,"Senate Democrats may block legislation proposed by their Republican counterparts that would allocate billions of dollars across the country, citing a push for more aid for Puerto Rico’s recovery.",https://www.nytimes.com/2019/03/28/us/politics/democrats-senate-puerto-rico-trump.html
0,"Rebuilding Puerto Rico, One House at a Time",2018-03-20T09:45:06+0000,Hurricane Maria ravaged the island six months ago this week. We’re still struggling to rebuild.,https://www.nytimes.com/2018/03/20/opinion/hurricane-maria-puerto-rico.html
0,"North Carolina, Warned of Rising Seas, Chose to Favor Development",2018-09-12T22:13:57+0000,"The legislature passed a law in 2012 to ignore evidence of sharp long-term rises in sea level, so the state’s fragile coastline would go on booming.",https://www.nytimes.com/2018/09/12/us/north-carolina-coast-hurricane.html
0,The Polar Vortex and the Climate,2019-02-01T12:55:16+0000,When a warming planet gets very cold.,https://www.nytimes.com/2019/02/01/opinion/polar-vortex-global-warming.html
0,"As Storms Loom, Some Immigrant Families Wonder: Is It Safe to Seek Help?",2018-09-19T18:07:58+0000,"For undocumented families living in fear of deportation, Florence presented an extra challenge: Whether to seek government shelter, food or other aid.",https://www.nytimes.com/2018/09/19/us/hurricane-florence-immigrants-carolinas.html
0,Hurricane Matthew: Photos of the Destruction in Haiti,2016-10-06T04:00:00+0000,"The storm killed at least 25 on its path through the island of Hispaniola, according to Reuters. But the authorities are just beginning efforts to fully assess the damage.",https://www.nytimes.com/2016/10/06/world/americas/hurricane-matthew-haiti.html
0,"FEMA Contract Called for 30 Million Meals for Puerto Ricans. 50,000 Were Delivered.",2018-02-06T15:00:13+0000,"FEMA terminated a big contract with a tiny vendor hired to produce meals for Puerto Rico after Hurricane Maria. Now, Congress is asking questions.",https://www.nytimes.com/2018/02/06/us/fema-contract-puerto-rico.html
0,"In Puerto Rico, Stadium Lights Glow, Homes Do Not",2018-04-19T02:38:15+0000,"An island-wide blackout related to repairs of the electrical grid wrecked in Hurricane Maria left people in the dark, but a baseball game soldiered on.",https://www.nytimes.com/2018/04/18/sports/baseball/puerto-rico-baseball-blackout.html
0,Emergency Manager Resigns in Puerto Rico; Army Ends Its Mission,2017-11-11T01:17:22+0000,"The head of Puerto Rico’s emergency management agency resigned Friday, on the same day that the Army announced that its mission on the island had ended.",https://www.nytimes.com/2017/11/10/us/puerto-rico-emergency-manager.html
0,"Hog Lagoons in North Carolina, After Hurricane Matthew",2016-11-04T17:14:37Z,The North Carolina Pork Council and an environmental group take different sides in the dispute.,https://www.nytimes.com/2016/11/05/opinion/hog-lagoons-in-north-carolina-after-hurricane-matthew.html
0,Quotation of the Day: The People Who Never Evacuate Aim to Stare Down a Monster,2018-09-13T11:04:14+0000,"Quotation of the Day for Thursday, September 13, 2018.",https://www.nytimes.com/2018/09/13/todayspaper/quotation-of-the-day-the-people-who-never-evacuate-aim-to-stare-down-a-monster.html
0,"Trump Surveys Tornado Damage in Alabama, and Signs Some Bibles, Too",2019-03-08T20:08:42+0000,"President Trump’s visit to Beauregard came after a tornado killed 23 people, and offered him a chance to act as consoler in chief — a role in which he has sometimes struggled.",https://www.nytimes.com/2019/03/08/us/trump-alabama.html
0,More Evacuations as ‘Monster’ Storm Looms,2018-09-11T09:13:48+0000,"Officials are imploring people to leave low-lying coastal areas and islands in the storm’s path, and more than one million people are expected to flee.",https://www.nytimes.com/2018/09/11/us/hurricane-florence-updates.html
0,Protest in Puerto Rico Over Austerity Measures Ends in Tear Gas,2018-05-01T22:47:05+0000,Thousands of Puerto Ricans protested in a general strike on Tuesday as the island struggles to recover from Hurricane Maria.,https://www.nytimes.com/2018/05/01/us/puerto-rico-protests.html
0,Trump to Puerto Rico: Who’s Your Daddy?,2019-04-04T00:09:17+0000,"The logic seems to go that everyone is better off, even minorities, when white people are calling the shots.",https://www.nytimes.com/2019/04/03/opinion/trump-puerto-rico.html
0,The Senate’s ‘Sham Vote’ on the Green New Deal,2019-03-29T16:59:33+0000,Readers berate politicians for not taking action on climate change.,https://www.nytimes.com/2019/03/29/opinion/letters/senate-green-new-deal.html
0,On the Resilient Waterfront,2018-05-31T09:00:01+0000,"A new shoreline park at Hunters Point South, in Queens, goes back to nature as a way to protect against future storms.",https://www.nytimes.com/2018/05/31/nyregion/on-the-resilient-waterfront.html
0,Trump’s NOAA Nominee Won’t Get Senate Vote This Year,2018-12-13T19:49:32+0000,"The White House will have to decide whether to renominate Barry Lee Myers, the chief executive of AccuWeather, next year.",https://www.nytimes.com/2018/12/13/climate/senate-noaa-barry-myers.html
0,It’s ‘Unreal’: A Panama City Resident Surveys the Damage,2018-10-13T01:07:04+0000,Emily Basham’s home was destroyed by Hurricane Michael. Now the mother of three is wondering how to start over.,https://www.nytimes.com/video/us/100000006159139/hurricane-michael-residents-return.html
0,"Haitians, Battered by Hurricane, Huddle in Caves: ‘This Is the Only Shelter We Have’",2016-10-17T18:51:32+0000,"“It is our house that God created when we most needed it,” said one of the hundreds of villagers who fled into caves as Hurricane Matthew destroyed their homes.",https://www.nytimes.com/2016/10/18/world/americas/haiti-hurricane-matthew-caves.html
0,Hurricane Hermine Thrashes Florida,2016-09-02T15:29:23+0000,Gov. Rick Scott told Florida residents how to survive Hurricane Hermine.,https://www.nytimes.com/video/us/100000004625084/hurricane-hermine-thrashes-florida.html
0,"On Fire Island, a Scar From Hurricane Sandy Is Seen as a Good Thing",2016-10-04T04:00:00+0000,"A breach caused by the storm four years ago has breathed new life into the Great South Bay, scientists say, flushing in fresh ocean water and pulling out polluted bay water.",https://www.nytimes.com/2016/10/04/nyregion/on-fire-island-a-scar-from-hurricane-sandy-is-seen-as-a-good-thing.html
0,Scenes of Destruction in Florida’s Panhandle,2018-10-12T21:22:48+0000,"In this 360 video, survey the widespread damage Hurricane Michael caused in Mexico Beach, Fla and its surrounding areas.",https://www.nytimes.com/video/us/100000006156635/hurricane-michael-panama-city-florida.html
0,"Corrections: December 19, 2018",2018-12-19T02:14:53+0000,"Corrections appearing in print on Wednesday, December 19, 2018.",https://www.nytimes.com/2018/12/18/pageoneplus/corrections-december-19-2018.html
0,North Carolina Hurricane Death Toll Rises,2016-10-11T17:20:33Z,Gov. Pat McCrory of North Carolina said that by Tuesday there had been at least 14 deaths attributed to Hurricane Matthew and its aftermath.,https://www.nytimes.com/video/us/100000004703176/north-carolina-hurricane-death-toll-rises.html
0,Crusaders Come From Behind to Take South Island Honours,2019-04-12T10:47:07+0000,Super Rugby champions the Canterbury Crusaders recovered from a halftime deficit for the second week in a row on Friday to thrash the Otago Highlanders 43-17 and extend their unbeaten run at home to 24 matches.,https://www.nytimes.com/reuters/2019/04/12/sports/rugby/12reuters-rugby-union-super-crusaders.html
0,"Of Time, Tides and Trump",2018-09-20T00:32:27+0000,"The ocean is rising, but at least we’ve got hot dogs.",https://www.nytimes.com/2018/09/19/opinion/north-carolina-flooding-trump-lake-norman.html
0,"In Flood-Hit Public Housing, a Reminder That the Poor Bear Brunt of Storms’ Fury",2018-09-17T23:29:49+0000,"Residents of a North Carolina housing complex have found themselves at the center of a redevelopment drama, even as they wonder what will become of their Florence-hit homes.",https://www.nytimes.com/2018/09/17/us/hurricane-florence-new-bern-poor.html
0,Scenes From Hurricane Matthew’s Capricious Path,2016-10-09T04:00:00+0000,"In Haiti, the Bahamas and Florida, the storm left behind stories of disaster and disaster narrowly averted. Here are some of them.",https://www.nytimes.com/2016/10/09/us/scenes-from-hurricane-matthews-capricious-path.html
0,How a Team of New York City Inspectors Helped Puerto Rico After Maria,2018-01-14T23:37:48+0000,"Almost 300 city workers have been deployed to the island since the hurricane, including a team of inspectors that helped San Juan map damages to thousands of buildings.",https://www.nytimes.com/2018/01/14/nyregion/nyc-building-inspectors-puerto-rico-maria.html
0,Florida&#8217;s Vulnerability Tested as Hurricane Matthew Hugs Coast,2016-10-06T16:27:28Z,Hurricane Matthew will test Floridians’ level of “disaster amnesia” given the 11 years that have passed since the state was struck by a major hurricane.,https://dotearth.blogs.nytimes.com/2016/10/06/after-11-years-in-a-hurricane-drought-floridians-flee-major-matthew-threat/
0,Has America Forgotten the Virgin Islands?,2017-10-11T23:26:49+0000,"“It feels like we’ve been left to ourselves,” my friend said to me.",https://www.nytimes.com/2017/10/11/opinion/america-forgotten-virgin-islands.html
0,Golden Knights One Win From Advancing to 2nd Round Again,2019-04-17T23:07:05+0000,The Vegas Golden Knights are on the brink of reaching the second round for the second time in their two-year history.,https://www.nytimes.com/aponline/2019/04/17/sports/hockey/ap-hkn-faceoff.html
0,A Haitian Warlord Meets His Match: Hurricane Matthew,2016-10-19T19:48:47+0000,The storm has done what neither government nor armed forces have managed to accomplish: bring Guy Philippe to his knees as his community starves.,https://www.nytimes.com/2016/10/20/world/americas/haiti-guy-philippe-hurricane-matthew.html
0,Aid to Puerto Rico: An Appalling Lapse,2018-01-05T20:02:54+0000,A reader wonders how we can allow our fellow citizens to suffer.,https://www.nytimes.com/2018/01/05/opinion/letters/aid-puerto-rico.html
0,Presidential Lying Is Contagious,2018-09-23T21:44:03+0000,Donald Trump’s chronic dishonesty threatens to infect his entire administration.,https://www.nytimes.com/2018/09/23/opinion/trump-lies-white-house-dishonesty.html
0,Advocates of Puerto Rico Statehood Plan to Demand Representation,2018-01-09T18:34:12+0000,The island’s political leaders say the aftermath of Hurricane Maria and poor treatment in the new tax law make clear that residents need added political clout.,https://www.nytimes.com/2018/01/09/us/politics/advocates-of-puerto-rico-statehood-plan-to-demand-representation.html
0,Stephen Colbert Says Trump Is ‘Laser-Focused’ on the Storm (Last Year’s),2018-09-14T08:58:17+0000,"As Hurricane Florence approached, the president was busy disputing the death toll from Hurricane Maria, the “Late Show” host noticed.",https://www.nytimes.com/2018/09/14/arts/television/stephen-colbert-trump-hurricane-maria-florence.html
0,Hurricane Matthew: How The Times Prepares for a Coming Storm,2016-10-06T23:24:28+0000,Two veteran journalists discuss the challenges inherent in covering hurricanes.,https://www.nytimes.com/2016/10/07/insider/hurricane-matthew-how-the-times-prepares-for-a-coming-storm.html
0,"What Puerto Rico Is, and Isn’t, Getting in Disaster Relief",2018-02-08T22:41:17+0000,The aid proposed by the Senate is only a fraction of what Puerto Rico says it needs to recover from Hurricane Maria. But it’s a start.,https://www.nytimes.com/2018/02/08/us/puerto-rico-disaster-relief.html
0,1916: Hurricane Hits Jamaica,2016-08-22T14:00:36Z,From the archives of the International Herald Tribune: Hurricane leaves trail of destruction in Jamaica in August 1916.,https://iht-retrospective.blogs.nytimes.com/2016/08/22/1916-hurricane-hits-jamaica/
0,Puerto Rico in the Dark,2017-11-04T17:45:08+0000,Photographer Joseph Rodríguez captures the isolation of a storm-ravaged island.,https://www.nytimes.com/2017/11/04/opinion/sunday/puerto-rico-hurricane-maria.html
0,"Learning With: ‘Drawn by Gold, Drowned in Mud: Typhoon Kills Philippine Miners’",2018-09-18T08:00:01+0000,"What does the author mean when she writes, “On Monday evening, Mr. Feliciano got a reminder that what the Cordillera Mountains give, they also take away?”",https://www.nytimes.com/2018/09/18/learning/article-of-the-day-drawn-by-gold-drowned-in-mud-typhoon-kills-philippine-miners.html
0,"A Huge Storm, and Newsletter Changes",2018-09-12T19:38:01+0000,"We have a few thoughts about Hurricane Florence and climate change. And a new, more consistent format for our newsletter.",https://www.nytimes.com/2018/09/12/climate/a-huge-storm-and-newsletter-changes.html
0,Allison Janae Hamilton’s Spirit Sources,2018-10-26T08:00:07+0000,"Pine tar and turpentine, climate change and hurricanes affect her fantastical art of the rural South, in a show at Mass MoCA.",https://www.nytimes.com/2018/10/26/arts/design/allison-janae-hamilton-mass-moca.html
0,"Flooding in North Carolina, as Seen From a Drone",2018-09-19T20:41:33+0000,Aerial footage from North Carolina shows the scale of flooding in the aftermath of Hurricane Florence.,https://www.nytimes.com/video/us/100000006114997/florence-floods-north-carolina-drone.html
0,Puerto Rico Needs More Than Bandages,2018-02-13T00:06:25+0000,The island’s power and water utilities require wholesale rebuilding to achieve resilience against the next big storm.,https://www.nytimes.com/2018/02/12/opinion/puerto-rico-water-electricity.html
0,Haiti Braces for Catastrophe as Hurricane Matthew Makes Landfall,2016-10-03T15:51:06+0000,The Category 4 storm brought winds of up to 145 miles an hour and rainfall that could exceed three feet in some areas.,https://www.nytimes.com/2016/10/04/world/americas/hurricane-matthew-haiti-jamaica-cuba.html
0,"In Decades-Old Photos, Parallels to Puerto Rico’s Rudimentary Reality",2017-11-27T20:32:00+0000,A collection of photographs that arrived at Columbia University just ahead of Hurricane Maria includes images of poverty that could have been shot today.,https://www.nytimes.com/2017/11/27/nyregion/photos-puerto-rico-jack-delano.html
0,"Hurricane Hermine, Landing in Florida, Batters Tiny Towns",2016-09-02T04:00:00+0000,"The hurricane hit land in the northwestern part of the state. The storm, which has weakened, is expected to soak Georgia and the Carolinas.",https://www.nytimes.com/2016/09/02/us/florida-hurricane-hermine.html
0,A Weakened Hurricane Matthew Still Delivers Flooding and Power Failures,2016-10-09T04:00:00+0000,"At least 11 deaths were attributed to the storm, but it did not seem to be a catastrophe that would disrupt the coastlines of Florida, Georgia and the Carolinas for months.",https://www.nytimes.com/2016/10/09/us/hurricane-matthew-georgia-south-carolina.html
0,Islanders Beat Capitals to Earn Home-Ice in First Round,2019-04-09T15:55:15+0000,"Valtteri Filppula scored twice in his return from injury, Robin Lehner stopped all 29 shots he faced and the New York Islanders beat the Washington Capitals 3-0 in each team's regular-season finale Saturday night to clinch home-ice advantage in th...",https://www.nytimes.com/aponline/2019/04/09/sports/hockey/ap-hkn-islanders-capitals.html
0,Hurricane Season Is Heating Up. So Is the Planet. Coincidence?,2016-09-03T04:00:00+0000,"As Tropical Storm Hermine churns up the Atlantic and two other storms threaten Hawaii, a look at what role scientists think global warming may be playing.",https://www.nytimes.com/2016/09/03/us/hurricanes-global-warming.html
0,Returning to Vieques,2018-03-19T04:01:10+0000,"This lush, wild bit of Puerto Rico, a word-of-mouth destination that draws a loyal following of visitors, is rebuilding after last year’s ferocious hurricane season.",https://www.nytimes.com/2018/03/19/travel/vieques-hurricane-recovery.html
0,"How Storms, Missteps and an Ailing Grid Left Puerto Rico in the Dark",2018-05-06T09:00:01+0000,"It took months to restore electricity in Puerto Rico after hurricanes dealt a one-two punch. Many homes are still without power, and the system’s future is far from certain.",https://www.nytimes.com/interactive/2018/05/06/us/puerto-rico-power-grid-hurricanes.html
0,Questions for: ‘Hurricane Matthew Makes Old Problems Worse for Haitians’,2016-10-07T12:25:25+0000,What kinds of destruction did Hurricane Matthew cause in Haiti?,https://www.nytimes.com/2016/10/07/learning/questions-for-hurricane-matthew-makes-old-problems-worse-for-haitians.html
0,"After Hurricane Matthew, Devastation in Southern Haiti",2016-10-08T04:00:00+0000,The hurricane destroyed houses and left villages under several feet of water.,https://www.nytimes.com/2016/10/08/world/americas/after-hurricane-matthew-devastation-in-southern-haiti.html
0,Quotation of the Day: Florida Is Left Reeling as Storm Slashes Through Southeast,2018-10-12T02:31:56+0000,"Quotation of the Day for Friday, October 12, 2018.",https://www.nytimes.com/2018/10/11/todayspaper/quotation-of-the-day-florida-is-left-reeling-as-storm-slashes-through-southeast.html
0,Trump’s Frightening Closing Argument,2018-11-01T22:29:21+0000,The president returns to campaign combat mode.,https://www.nytimes.com/2018/11/01/opinion/trump-campaigning-violence.html
0,Carols by a Cellphone’s Glow: See How Puerto Rico Is Celebrating Christmas,2017-12-22T10:00:58+0000,"Large parts of Puerto Rico still don’t have power after Hurricane Maria, but some residents are determined to celebrate Christmas one way or another.",https://www.nytimes.com/2017/12/22/us/hurricane-maria-christmas-puerto-rico.html
0,"Quotation of the Day: $2.5 Billion in Storm Losses, but Don’t Ask Georgia Farmers About Climate Change",2018-10-20T01:40:08+0000,"Quotation of the Day for Saturday, October 20, 2018.",https://www.nytimes.com/2018/10/19/todayspaper/quotation-of-the-day-2-5-billion-in-storm-losses-but-dont-ask-georgia-farmers-about-climate-change.html
0,Hurricane Matthew Blows Away Couples’ Wedding Plans,2016-10-16T04:00:00+0000,The storm caused at least two couples — one in Georgia and one in South Carolina — to make last-minute changes to their plans to walk down the aisle.,https://www.nytimes.com/2016/10/11/style/hurricane-matthew-weddings.html
0,NHL Roundup: Blue Jackets Clinch Last Playoff Spot,2019-04-06T08:03:53+0000,"Artemi Panarin scored the only goal in the shootout Friday night for the Columbus Blue Jackets, who clinched the last open NHL playoff spot by edging the host New York Rangers, 3-2.",https://www.nytimes.com/reuters/2019/04/06/sports/hockey/06reuters-icehockey-nhl-roundup.html
0,N.Y.U. Will Waive Tuition for Displaced Puerto Rican Students,2017-11-09T22:00:58+0000,The university joins others across the nation accepting students whose studies were interrupted by Hurricane Maria for a tuition-free semester.,https://www.nytimes.com/2017/11/09/nyregion/nyu-puerto-rico-hurricane-maria.html
0,Jennifer Lopez Donates $1 Million to Puerto Rico Relief Effort,2017-09-25T16:42:58+0000,"The singer, who is of Puerto Rican descent, is leading a New York-state-wide donation drive in the wake of Hurricanes Irma and Maria.",https://www.nytimes.com/2017/09/25/arts/music/jennifer-lopez-donates-1-million-to-puerto-rico-relief-effort.html
0,Four Senators Seek Longer Foreclosure Delay in Puerto Rico,2017-12-22T21:58:28+0000,A bipartisan group is asking that a moratorium on foreclosures in Puerto Rico be extended to March 2019 as residents repair damage from Hurricane Maria.,https://www.nytimes.com/2017/12/22/business/puerto-rico-mortgage-foreclosures.html
0,"Burying Their Cattle, Ranchers Call Wildfires ‘Our Hurricane Katrina’",2017-03-20T09:00:19+0000,An existential threat to a way of life that has sustained cattle-raising families since homesteading days.,https://www.nytimes.com/2017/03/20/us/burying-their-cattle-ranchers-call-wildfires-our-hurricane-katrina.html
0,"Hurricane Matthew Avoids Direct Hit on Florida, Continues North",2016-10-08T04:00:00+0000,"The storm weakened slightly, to Category 3, with winds of about 120 m.p.h. It was pushing north toward South Carolina, moving just off the coast.",https://www.nytimes.com/2016/10/07/us/hurricane-matthew.html
0,The Year From Above,2017-12-19T10:00:02+0000,"A look at some of 2017’s biggest news events, in aerial photos, satellite pictures and other imagery.",https://www.nytimes.com/interactive/2017/12/19/world/year-from-above.html
0,"Better Weather Forecasts, and These Pretty Pictures, Too",2017-01-25T18:10:17+0000,"NOAA released the first batch of images taken by its GOES-16 satellite, which it says is like going from black and white to HDTV.",https://www.nytimes.com/2017/01/25/science/noaa-goes-16-satellite-photos.html
0,More Floods and More Droughts: Climate Change Delivers Both,2018-12-12T15:00:04+0000,"More records for both wet and dry weather are being set around the globe, according to a study published Wednesday.",https://www.nytimes.com/2018/12/12/climate/climate-change-floods-droughts.html
0,When the Next Hurricane Hits Texas,2016-10-07T12:10:16+0000,The petrochemical industry from Galveston to Houston is an environmental catastrophe waiting to happen.,https://www.nytimes.com/2016/10/09/opinion/sunday/when-the-hurricane-hits-texas.html
0,Torrents of Water in Towns Across the Carolinas. And a Guy With a Boat.,2018-09-15T15:20:02+0000,An improvised network of volunteers has sprung up to locate and rescue people who did not evacuate for Tropical Storm Florence.,https://www.nytimes.com/2018/09/15/us/florence-volunteer-rescue.html
0,Puerto Rico’s Actual Death Toll,2017-11-13T20:15:23+0000,Trump’s initial figure turns out to be woefully low.,https://www.nytimes.com/2017/11/13/opinion/puerto-rico-death-maria.html
0,Must-Do for Florida’s Midterm Candidates: A Stop in Puerto Rico. Or Three.,2018-05-17T09:00:10+0000,"Florida candidates have traveled repeatedly to the island, a sign Puerto Ricans have become an increasingly important constituency.",https://www.nytimes.com/2018/05/17/us/puerto-rico-florida-politics-midterm.html
0,"On Politics: Julian Assange, Now in Custody, Faces U.S. Hacking Charge",2019-04-12T04:14:58+0000,"The WikiLeaks founder empowered a generation of whistle-blowers, but he was a highly problematic champion for press freedom and the public’s right to know.",https://www.nytimes.com/2019/04/12/us/politics/wikileaks-julian-assange-arrested.html
0,Houston Speculators Make a Fast Buck From Storm’s Misery,2018-03-23T09:00:11+0000,A new economy has arisen in the suburbs of Houston battered by storms: the buying and selling of flooded homes.,https://www.nytimes.com/2018/03/23/us/flooding-canyon-gate-hurricane-harvey.html
0,"The Devastation in Puerto Rico, as Seen From Above",2017-09-27T09:00:25+0000,Aerial imagery shows the destruction that Hurricane Maria brought to the United States commonwealth.,https://www.nytimes.com/interactive/2017/09/27/us/puerto-rico-hurricane-maria-before-after.html
0,"Personal Data of 2.3 Million Disaster Victims Was Released by FEMA, Report Says",2019-03-23T01:07:30+0000,The report said sensitive personal information of victims of the 2017 California wildfires and three hurricanes was needlessly shared with a contractor.,https://www.nytimes.com/2019/03/22/us/fema-data-breach.html
0,They Won't Let Anyone Else in' &#8211; Japan Captain Leitch on Sunwolves Expulsion,2019-04-09T14:01:52+0000,"Japan captain Michael Leitch has accused some top tier nations of wanting to keep high level rugby to themselves after the Sunwolves, Japan's representatives in Super Rugby, were told they would be cut from the elite competition after the 2020 sea...",https://www.nytimes.com/reuters/2019/04/09/sports/rugby/09reuters-rugby-union-super-sunwolves-leitch.html
0,Hurricane Matthew Approaches Florida; Governor Urges 1.5 Million to Flee,2016-10-07T04:00:00+0000,"The storm intensified Thursday into a Category 4 hurricane with winds of at least 140 m.p.h., with officials warning of “life-threatening weather conditions.”",https://www.nytimes.com/2016/10/06/us/hurricane-matthew-us.html
0,"First Day for Goldman’s New C.E.O., and Job Numbers Come Out ",2018-09-30T18:29:09+0000,"September auto sales figures are expected to show continued strength, and European finance ministers are meeting. ",https://www.nytimes.com/2018/09/30/business/first-day-for-goldmans-new-ceo-and-job-numbers-come-out.html
0,Listen to ‘The Daily’: In Florida and Bracing for Irma,2017-09-11T09:59:14+0000,"We speak with two Miami residents, one who refused to evacuate and one who drove north, only to end up in Irma’s path.",https://www.nytimes.com/2017/09/11/podcasts/the-daily/voices-from-florida-irma.html
0,José Andrés Fights Starvation With Mayo,2018-02-28T10:01:08+0000,The Michelin-starred chef on his time in Puerto Rico after the hurricane and his legal issues with the Trump family.,https://www.nytimes.com/2018/02/28/magazine/jose-andres-fights-starvation-with-mayo.html
0,Why We Ride Out Life-Threatening Storms and Do Other Crazy Things,2018-10-11T15:05:39+0000,It’s called denial. And denial is hope on steroids.,https://www.nytimes.com/2018/10/11/opinion/hurricanes-disasters-denial-insurance.html
